<?xml version="1.0" encoding="UTF-8"?>
<A9-ArchaeologicalExcavation xmlns:xsi="http://www.w3.org/2001/XMLSchema-instance" 
xsi:noNamespaceSchemaLocation="C:\Users\mark2\OneDrive\Ambiente de Trabalho\Projeto MegaLOD\arrow-heads\Code\EsquemaXML\arrowhead.xsd">
    <E53-Place>
        <Name>asdad</Name>
        <District></District>
        <Parish></Parish>
        <Gps>
            <Latitude></Latitude>
            <Longitude></Longitude>
        </Gps>
        <A2-StratigraphicVolumeUnit>
            <Timeline></Timeline>
            <Description></Description>
            <Gps>
                <Latitude></Latitude>
                <Longitude></Longitude>
            </Gps>
            <S19-EncounterEvent>
                <Date>2001-11-12</Date>
                <E24-PhysicalManThing Inventory_number="1">
                    <E36-VisualItem></E36-VisualItem>
                    <Order_number>Triangular</Order_number>
                    <Group>
                        <Group-name>Reta</Group-name>
                        <Sub_type>true</Sub_type>
                    </Group>
                    <E3-ConditionState>
                        <E55-Type></E55-Type>
                    </E3-ConditionState>
                    <E55-Type>Alongado</E55-Type>
                    <Variant>Espessa</Variant>
                    <Typometry Unit="mm">
                        <Lenght>23</Lenght>
                        <Width>12</Width>
                        <Thickness>5</Thickness>
                        <Body_lenght>19</Body_lenght>
                        <Base_lenght>4</Base_lenght>
                    </Typometry>
                    <Morphology>
                        <Point>true</Point>
                        <Body>false</Body>
                        <Base>Triangular</Base>
                    </Morphology>
                    <Retouch>
                        <Location></Location>
                        <Mode></Mode>
                        <Amplitude></Amplitude>
                        <Direction></Direction>
                        <Delineation></Delineation>
                        <Orientation></Orientation>
                        <Shape></Shape>
                    </Retouch>
                    <Raw_material></Raw_material>
                    <Observations></Observations>
                </E24-PhysicalManThing>
            </S19-EncounterEvent>
        </A2-StratigraphicVolumeUnit>
    </E53-Place>
</A9-ArchaeologicalExcavation>